{"advantage_status":"통계적 우위 없음","candidate_sets":[{"joint_probability":1.2277380399898834e-07,"lift_vs_uniform":1.0,"numbers":[11,15,16,23,25,36],"rank":1},{"joint_probability":1.2277380399898834e-07,"lift_vs_uniform":1.0,"numbers":[1,2,3,7,21,45],"rank":2},{"joint_probability":1.2277380399898834e-07,"lift_vs_uniform":1.0,"numbers":[4,5,6,26,29,40],"rank":3},{"joint_probability":1.2277380399898834e-07,"lift_vs_uniform":1.0,"numbers":[8,9,10,19,28,37],"rank":4},{"joint_probability":1.2277380399898834e-07,"lift_vs_uniform":1.0,"numbers":[12,13,20,27,32,44],"rank":5}],"contract_version":"product-release-candidate-1.0.0","diagnostics":{"cutoff":{"cutoff_hash":"9db24edd35908a4db3743bddfcccdc61e2c0656dce177e528f36708e5cbd6151","excluded_draws_at_or_after_target":0,"input_first_draw":1,"input_last_draw":1230,"input_record_count":1230,"target_draw_no":1231},"shadow":null,"shadow_enabled":false},"final_distribution":"M0_ONLY","generated_at":"2026-07-03T00:00:00Z","hashes":{"config_hash":"a1acfc779eb0f2878f93301aa3ba6dba6249e15c76fd48cbc7f182b3192c6df3","data_hash":"57bb04ef188b5b06298b8a97fc73174d746de0568e33423f50029de31efa5cf1","model_hash":"d68e1281899177a229733f08cb49f15a6c4c2e8e39f93d805066581bdb13a70d","prediction_hash":"119f28875355952fa5c80e2095e70c096aee081ee56c750fa4caf2e373c5fe32"},"input_last_draw":1230,"limitations":["canonical_data_auto_checked_not_officially_locked","no_validated_nonuniform_signal","not_a_claim_of_improved_lottery_odds"],"product_weights":{"M0":1.0,"M1":0.0,"M2":0.0,"M3":0.0,"M4":0.0},"public_release_allowed":false,"reason":"no_validated_nonuniform_signal","research_only":true,"schema_version":"1.0.0","seed":"9b3f1a4163808ebc1f3f883dbb7e2589766426db80d7ffad4c11abfc8b298a0f","statistical_edge":false,"target_draw_no":1231,"versions":{"candidate_contract_version":"1.0.0","data_version":"draws-2026.06.27-r1","engine_core_version":"2.0.0-research","feature_contract_version":"1.0.0","model_version":"5.0.0-research-m0-product"}}
